{
  "schema_version": 1,
  "id": "presentation.motor_trial",
  "is_default": false,
  "level": "motor_trial",
  "garage": {
    "heading": "认识电机",
    "brief": "扭矩、效率与极速，三种齿比取舍。先猜谁先到、谁更省，再看洛一跑给你看。",
    "component_columns": [
      {
        "slot": "tires",
        "title": "驱动轮胎",
        "options": [
          "tires.standard",
          "tires.grip",
          "tires.eco"
        ]
      },
      {
        "slot": "motor",
        "title": "电机",
        "options": [
          "motor.standard",
          "motor.torque",
          "motor.eco",
          "motor.speed"
        ]
      }
    ],
    "policy_title": "驾驶风格",
    "policies": [
      "policy.careful",
      "policy.balanced",
      "policy.swift",
      "policy.express"
    ],
    "default_build": {
      "tires": "tires.standard",
      "motor": "motor.eco",
      "style": 0.5
    },
    "recommended_build": {
      "tires": "tires.standard",
      "motor": "motor.speed",
      "style": 1.0
    }
  },
  "prediction": {
    "heading": "极速一定赢吗？",
    "hint": "先做预测。高速齿比更快，但起步、坡道、能耗和制动都要付代价。",
    "choices": [
      {
        "id": "motor_trial.power.speed",
        "text": "高速电机在直道最快",
        "feedback": "看它是否有足够直道发挥极速，也要检查能耗与停车距离。"
      },
      {
        "id": "motor_trial.power.torque",
        "text": "扭矩电机起步最快",
        "feedback": "堵转力带来更强起步，但低齿比也限制最终速度。"
      },
      {
        "id": "motor_trial.power.eco",
        "text": "高效电机综合最好",
        "feedback": "如果时间要求不高，较低能耗可能比绝对速度更有价值。"
      }
    ]
  },
  "running": {
    "heading": "抵达仓库校准点",
    "normal_line": "洛一：正在体会新电机的脾气。",
    "detected_line": "洛一：前方状态已确认。"
  },
  "debrief": {
    "success_title": "认识了电机",
    "success_summary": "高速、扭矩和效率写在同一张成绩单上；齿比选择没有免费午餐。",
    "failure_summary": "换一台电机，或者给预算留一点余量。",
    "evidence_heading": "本次运动",
    "evidence_caption": "用时与能耗都来自真实仿真，不是文案。",
    "knowledge_title": "电机与能耗",
    "failure_titles": {
      "collision-static": "试跑失败：碰到了障碍",
      "timeout": "试跑失败：没有抵达校准点"
    }
  }
}
