{
  "schema_version": 1,
  "id": "presentation.long_haul",
  "is_default": false,
  "level": "long_haul",
  "garage": {
    "heading": "跑个长途",
    "brief": "信号塔回标定点，横穿整个仓库。没有叉车，考配速和耐心。",
    "component_columns": [
      {
        "slot": "tires",
        "title": "驱动轮胎",
        "options": [
          "tires.standard",
          "tires.grip",
          "tires.eco"
        ]
      },
      {
        "slot": "sensor",
        "title": "距离雷达",
        "options": [
          "sensor.short_fast_lidar",
          "sensor.standard_lidar",
          "sensor.long_slow_lidar"
        ]
      },
      {
        "slot": "motor",
        "title": "电机",
        "options": [
          "motor.standard",
          "motor.torque",
          "motor.eco"
        ]
      }
    ],
    "policy_title": "驾驶风格",
    "policies": [
      "policy.careful",
      "policy.balanced",
      "policy.swift"
    ],
    "default_build": {
      "tires": "tires.eco",
      "sensor": "sensor.long_slow_lidar",
      "motor": "motor.standard",
      "style": 1.0
    },
    "recommended_build": {
      "tires": "tires.grip",
      "sensor": "sensor.short_fast_lidar",
      "motor": "motor.standard",
      "style": 0.0
    }
  },
  "prediction": {
    "heading": "长途，短板在哪？",
    "hint": "先做预测。匀速和冲刺，哪个先到标定点？",
    "choices": [
      {
        "id": "long_haul.link.pace",
        "text": "配速会决定胜负",
        "feedback": "如果全程重脚油门，时间和电量一起丢。看用时和电表。"
      },
      {
        "id": "long_haul.link.corner",
        "text": "转弯会浪费时间",
        "feedback": "如果进弯太晚，只能绕大圈。看转弯处的轨迹。"
      }
    ]
  },
  "running": {
    "heading": "把洛一开回标定点",
    "normal_line": "洛一：长途巡航中，配速稳定。",
    "detected_line": "洛一：前方状态已确认。"
  },
  "debrief": {
    "success_title": "长途抵达",
    "success_summary": "横穿仓库：匀速就是最快，温柔就是节能。",
    "failure_summary": "看看是哪一项评分丢了，长途最怕忽快忽慢。",
    "evidence_heading": "本次驾驶",
    "evidence_caption": "三项评分分别对应安全、迅速与节能，来自真实仿真。",
    "knowledge_title": "配速",
    "failure_titles": {
      "collision-static": "运送失败：碰到了障碍",
      "collision-dynamic": "运送失败：与叉车发生碰撞",
      "timeout": "运送失败：没有在时限内送达"
    }
  }
}
