{
  "schema_version": 1,
  "id": "presentation.rally",
  "is_default": false,
  "level": "rally",
  "garage": {
    "heading": "全员集结",
    "brief": "轮胎、雷达、电机第一次联手。没有叉车，不考极限，只看配合。",
    "component_columns": [
      {
        "slot": "tires",
        "title": "驱动轮胎",
        "options": [
          "tires.standard",
          "tires.grip",
          "tires.eco"
        ]
      },
      {
        "slot": "sensor",
        "title": "距离雷达",
        "options": [
          "sensor.short_fast_lidar",
          "sensor.standard_lidar",
          "sensor.long_slow_lidar"
        ]
      },
      {
        "slot": "motor",
        "title": "电机",
        "options": [
          "motor.standard",
          "motor.torque",
          "motor.eco"
        ]
      }
    ],
    "policy_title": "驾驶风格",
    "policies": [
      "policy.careful",
      "policy.balanced",
      "policy.swift"
    ],
    "default_build": {
      "tires": "tires.eco",
      "sensor": "sensor.long_slow_lidar",
      "motor": "motor.standard",
      "style": 0.0
    },
    "recommended_build": {
      "tires": "tires.grip",
      "sensor": "sensor.short_fast_lidar",
      "motor": "motor.standard",
      "style": 0.0
    }
  },
  "prediction": {
    "heading": "第一次联手，短板在哪？",
    "hint": "先做预测。跑完看三项评分，短板会自己举手。",
    "choices": [
      {
        "id": "rally.link.perception",
        "text": "感知会拖后腿",
        "feedback": "如果雷达看得太晚，刹车再好也来不及。看首次发现的时刻。"
      },
      {
        "id": "rally.link.energy",
        "text": "能耗会先超标",
        "feedback": "如果为了快而费电，节能分会先丢。看电表的数字。"
      }
    ]
  },
  "running": {
    "heading": "把能源送到信号塔",
    "normal_line": "洛一：全员在线，正在配合走完全程。",
    "detected_line": "洛一：前方状态已确认。"
  },
  "debrief": {
    "success_title": "第一章完成",
    "success_summary": "洛一认全了零件，也第一次靠配合走完全程。",
    "failure_summary": "看看是哪一项评分丢了，换对应零件再试。",
    "evidence_heading": "本次配合",
    "evidence_caption": "三项评分分别对应安全、迅速与节能，来自真实仿真。",
    "knowledge_title": "组合与配合",
    "failure_titles": {
      "collision-static": "集结失败：碰到了障碍",
      "collision-dynamic": "集结失败：与叉车发生碰撞",
      "timeout": "集结失败：没有在时限内送达"
    }
  }
}
