{
  "schema_version": 1,
  "id": "presentation.first_sight",
  "is_default": false,
  "level": "first_sight",
  "garage": {
    "heading": "给洛一装上第一双眼睛",
    "brief": "出口外出现一扇透明门。选择距离雷达，让洛一知道前方并不是空路。",
    "component_columns": [
      {
        "slot": "tires",
        "title": "驱动轮胎",
        "options": [
          "tires.standard",
          "tires.grip",
          "tires.eco"
        ]
      },
      {
        "slot": "sensor",
        "title": "距离雷达",
        "options": [
          "sensor.short_fast_lidar",
          "sensor.standard_lidar",
          "sensor.long_slow_lidar"
        ]
      }
    ],
    "policy_title": "驾驶风格",
    "policies": [
      "policy.careful",
      "policy.balanced",
      "policy.swift"
    ],
    "default_build": {
      "tires": "tires.eco",
      "sensor": "sensor.long_slow_lidar",
      "style": 0.8
    },
    "recommended_build": {
      "tires": "tires.grip",
      "sensor": "sensor.short_fast_lidar",
      "style": 0.8
    }
  },
  "prediction": {
    "heading": "怎样更早确认玻璃门？",
    "hint": "量程决定看多远，刷新频率决定多久得到一次新测量。",
    "choices": [
      {
        "id": "sight.range",
        "text": "只要量程最远就行",
        "feedback": "看得远不等于更新及时；接近障碍时，两次扫描之间的空档也很关键。"
      },
      {
        "id": "sight.refresh",
        "text": "距离和刷新都要考虑",
        "feedback": "记录这个判断。运行时观察扫描点何时出现，以及洛一留出了多少制动空间。"
      },
      {
        "id": "sight.map",
        "text": "地图会自动看见一切",
        "feedback": "地图只能保存已有信息；传感器负责把当前环境变成测量。"
      }
    ]
  },
  "running": {
    "heading": "在玻璃门前安全停车",
    "normal_line": "洛一：雷达正在扫描，我会在安全区内停车。",
    "detected_line": "洛一：前方回波稳定，正在控制制动。"
  },
  "debrief": {
    "success_title": "洛一第一次看见了障碍",
    "success_summary": "距离测量让透明的玻璃门变成了可判断的信息。",
    "failure_summary": "比较量程、刷新频率和制动距离，再选择一次。",
    "evidence_heading": "感知证据",
    "evidence_caption": "扫描点和停车位置都由本次仿真生成。",
    "knowledge_title": "距离感知",
    "failure_titles": {
      "collision-static": "任务失败：没有在门前停住",
      "timeout": "任务失败：没有完成感知测试"
    }
  }
}
